{
  "$schema": "https://licoarc.com/spec/schemas/security-formal-bindings.schema.json",
  "$id": "https://licoarc.com/spec/v1/security/formal-bindings.json",
  "registryVersion": "licoarc.formal-bindings.v1",
  "lifecycle": "Candidate",
  "status": "partial",
  "requiredKinds": [
    "protocol-line-id",
    "profile-id",
    "algorithm-id",
    "domain-separator",
    "field-label",
    "bound",
    "failure-enum"
  ],
  "semanticSourceDigest": "84420faa1c223345db91037dfc0055757f8b2708701a6db321a0703b7aa5ed26",
  "semanticSources": [
    "spec/protection-profiles.json",
    "spec/protocol-lines.json",
    "spec/v1/foundation/targets.json",
    "spec/v1/group/continuity.md",
    "spec/v1/group/resolution.schema.json",
    "spec/v1/identity/identity.policy.json",
    "spec/v1/identity/identity.schema.json",
    "spec/v1/identity/labels.json",
    "spec/v1/identity/registry.json",
    "spec/v1/identity/runtime.cddl",
    "spec/v1/identity/signature-profiles.json",
    "spec/v1/identity/source-manifest.json",
    "spec/v1/messaging/capabilities.md",
    "spec/v1/messaging/capability-generation.schema.json",
    "spec/v1/messaging/capability-page.schema.json",
    "spec/v1/messaging/capability-sync.schema.json",
    "spec/v1/messaging/capability.schema.json",
    "spec/v1/protection/algorithms.json",
    "spec/v1/protection/bounds.json",
    "spec/v1/protection/domains.json",
    "spec/v1/protection/failures.json",
    "spec/v1/protection/handshake.schema.json",
    "spec/v1/protection/labels.json",
    "spec/v1/protection/prekey-bundle.schema.json",
    "spec/v1/protection/profile.json",
    "spec/v1/protection/record.schema.json",
    "spec/v1/protection/runtime.cddl",
    "spec/v1/protection/session-accept.schema.json",
    "spec/v1/protection/state.json",
    "spec/v1/reliable/bounds.json",
    "spec/v1/reliable/confirmation.schema.json",
    "spec/v1/reliable/continuity.md",
    "spec/v1/reliable/event.schema.json",
    "spec/v1/reliable/intent.schema.json",
    "spec/v1/reliable/labels.json",
    "spec/v1/reliable/registry.json",
    "spec/v1/reliable/runtime.cddl",
    "spec/v1/reliable/source-manifest.json",
    "spec/v1/reliable/state.schema.json",
    "spec/v1/transport/bounds.json",
    "spec/v1/transport/labels.json",
    "spec/v1/transport/registry.json",
    "spec/v1/transport/request.schema.json",
    "spec/v1/transport/response.schema.json",
    "spec/v1/transport/runtime.cddl",
    "spec/v1/transport/source-manifest.json"
  ],
  "bindings": [],
  "authority": "generated-only-from-decided-specified-normative-sources",
  "missingBindingPolicy": "claim-remains-unproved-and-line-ineligible",
  "modelAuthority": "never-a-second-protocol"
}
